mysql> use sunil;
Database changed
mysql> show tables;
+-----------------+
| Tables_in_sunil |
+-----------------+
| course          |
| employee        |
| income          |
| mentees         |
| mentees1        |
| student         |
+-----------------+
6 rows in set (0.00 sec)

mysql> select*from mentees1;
+-------+---------+------+------------+-------+
| regno | name    | dept | fathername | marks |
+-------+---------+------+------------+-------+
|   123 | sunil   | cse  | ram        |    94 |
|   124 | hithesh | ece  | rghu       |    95 |
|   125 | kiran   | aids | arjun      |    93 |
+-------+---------+------+------------+-------+
3 rows in set (0.02 sec)

mysql> alter table mentees1 add subject varchar(10);
Query OK, 3 rows affected (0.39 sec)
Records: 3  Duplicates: 0  Warnings: 0

mysql> update mentees1 set subject="pdsd" where dept="cse";
Query OK, 1 row affected (0.16 sec)
Rows matched: 1  Changed: 1  Warnings: 0

mysql> update mentees1 set subject="dbms" where dept="ece";
Query OK, 1 row affected (0.14 sec)
Rows matched: 1  Changed: 1  Warnings: 0

mysql> update mentees1 set subject="python" where dept="aids";
Query OK, 1 row affected (0.13 sec)
Rows matched: 1  Changed: 1  Warnings: 0

mysql> select*from mentees1;
+-------+---------+------+------------+-------+---------+
| regno | name    | dept | fathername | marks | subject |
+-------+---------+------+------------+-------+---------+
|   123 | sunil   | cse  | ram        |    94 | pdsd    |
|   124 | hithesh | ece  | rghu       |    95 | dbms    |
|   125 | kiran   | aids | arjun      |    93 | python  |
+-------+---------+------+------------+-------+---------+
3 rows in set (0.00 sec)

mysql> select*from mentees1 where marks between 94 and 100;
+-------+---------+------+------------+-------+---------+
| regno | name    | dept | fathername | marks | subject |
+-------+---------+------+------------+-------+---------+
|   123 | sunil   | cse  | ram        |    94 | pdsd    |
|   124 | hithesh | ece  | rghu       |    95 | dbms    |
+-------+---------+------+------------+-------+---------+
2 rows in set (0.00 sec)

mysql> select*from mentees1 where marks not between 94 and 100;
+-------+-------+------+------------+-------+---------+
| regno | name  | dept | fathername | marks | subject |
+-------+-------+------+------------+-------+---------+
|   125 | kiran | aids | arjun      |    93 | python  |
+-------+-------+------+------------+-------+---------+
1 row in set (0.00 sec)

mysql> select*from mentees1 where subject in('dbms');
+-------+---------+------+------------+-------+---------+
| regno | name    | dept | fathername | marks | subject |
+-------+---------+------+------------+-------+---------+
|   124 | hithesh | ece  | rghu       |    95 | dbms    |
+-------+---------+------+------------+-------+---------+
1 row in set (0.00 sec)

mysql> select avg(marks) as average from mentees1;
+---------+
| average |
+---------+
| 94.0000 |
+---------+
1 row in set (0.11 sec)

mysql> select min(marks) as minimum from mentees1;
+---------+
| minimum |
+---------+
|      93 |
+---------+
1 row in set (0.00 sec)